{
  "integration_record_ref": ".build/skeleton/integration-record.json",
  "build_record_ref": ".build/skeleton/build-record.json",
  "oracle_lock_ref": ".build/skeleton/oracle/oracle.lock",
  "oracle_ref": ".build/skeleton/oracle/oracle.json",
  "nfr_mechanisms_ref": ".hld/skeleton/nfr-mechanisms.json",
  "components_ref": ".hld/skeleton/components.json",
  "skeleton_lock_ref": ".hld/skeleton.lock",
  "adr_lock_ref": ".adr/adr.lock",
  "aprd_lock_ref": ".aprd/aprd.lock",
  "locks_verified": true,
  "class": "greenfield",
  "mode": "skeleton-build",
  "slice": "S1",
  "verification_method": "static-trace",
  "ladder": {
    "contract": {
      "layer_verdict": "pass",
      "tests": [
        {
          "id": "OCT-CT1",
          "target": "CT1",
          "provider": "C1",
          "caller": "C2",
          "module": "freelancer_app.data_store.identity_record_store",
          "shape": {
            "test": "test_ct1_shape_persists_identity_record",
            "result": "pass",
            "trace": "mock_data_store_ct1 patches freelancer_app.data_store.identity_record_store. Test imports the mock. save_identity returns non-None dict -> assert result is not None PASS. get_identity returns dict -> fetched not None PASS; isinstance(fetched, dict)=True -> assert hasattr(fetched,'provider') or isinstance(fetched,dict) PASS."
          },
          "failures": [
            {
              "test": "test_ct1_failure_store_unavailable",
              "result": "pass",
              "trace": "save_identity.side_effect=ConnectionError. oauth_callback.handle_callback calls data_store.identity_record_store.save_identity via attribute access -> mock raises ConnectionError -> propagates -> pytest.raises catches. mock.save_identity.called=True PASS. exc_info.value not None PASS."
            },
            {
              "test": "test_ct1_failure_constraint_violation",
              "result": "pass",
              "trace": "save_identity.side_effect=ValueError. First handle_callback call raises ValueError -> pytest.raises catches -> call_count>=1 PASS. Second handle_callback in nested pytest.raises also raises ValueError -> caught PASS."
            },
            {
              "test": "test_ct1_failure_partial_failure",
              "result": "pass",
              "trace": "save_identity.side_effect=RuntimeError. handle_callback raises RuntimeError -> pytest.raises catches PASS. mock.get_identity.return_value=None; mock.get_identity() returns None -> assert result is None PASS."
            }
          ]
        },
        {
          "id": "OCT-CT8",
          "target": "CT8",
          "provider": "C2",
          "caller": "C6",
          "module": "freelancer_app.web_ingress.session_gate",
          "shape": {
            "test": "test_ct8_shape_session_presence_signal",
            "result": "pass",
            "trace": "mock_identity_auth_ct8 patches freelancer_app.identity_auth.session_checker. Authenticated: check_session.return_value={'authenticated':True,'identity_ref':'uid-shape-test'}. session_gate.check({'session':'valid-token'}) -> identity_auth.session_checker.check_session('valid-token') via attribute access -> mock returns session dict -> returned. result not None PASS; result.get('authenticated')=True -> assert is_authenticated PASS. Unauthenticated: check_session.return_value=None. session_gate.check({}) -> check_session(None) -> None -> {'authenticated':False}. is_authenticated_unauth=False -> assert not is_authenticated_unauth PASS."
          },
          "failures": [
            {
              "test": "test_ct8_failure_no_valid_session",
              "result": "pass",
              "trace": "check_session.return_value=None. handle_authenticated_request({}, 'project_management') -> check({}) -> check_session(None) -> None -> {'authenticated':False} -> not authenticated -> returns {'redirect':'/login','dispatched':False}. redirect_location='/login' not None PASS. dispatched=False -> assert not dispatched PASS."
            },
            {
              "test": "test_ct8_failure_callee_error",
              "result": "pass",
              "trace": "check_session.side_effect=RuntimeError. handle_authenticated_request({'session':'maybe-valid'}, 'project_management') -> check() -> check_session('maybe-valid') raises RuntimeError -> propagates out of check() -> caught by except Exception in handle_authenticated_request -> returns {'redirect':'/login','dispatched':False}. redirect_location='/login' not None PASS. dispatched=False PASS."
            }
          ]
        }
      ]
    },
    "flow": {
      "layer_verdict": "pass",
      "tests": [
        {
          "id": "OF-F1",
          "target": "F1",
          "path": ["C6", "C2", "C1"],
          "wsgi_entry": "freelancer_app.wsgi.application",
          "happy": {
            "test": "test_f1_happy_path_oauth_login_establishes_session",
            "asserts_ac": ["AC1", "AC5"],
            "result": "pass",
            "assertions": [
              {
                "id": "F1/AC1-response-started",
                "result": "pass",
                "trace": "GET / -> _view_entry_page -> session_gate.check({}) -> session_checker.check_session(None) (real, no mock here) -> returns None -> {'authenticated':False} -> renders unauthenticated HTML -> HttpResponse(200) calls start_response -> response_started non-empty PASS."
              },
              {
                "id": "F1/AC1-status-lt-400",
                "result": "pass",
                "trace": "HttpResponse(status=200) -> status_code=200 < 400 PASS."
              },
              {
                "id": "F1/AC1-body-non-empty",
                "result": "pass",
                "trace": "Body = b'<html><body><h1>Freelancer Time Tracker</h1><p>Please sign in...</p><a href=\"/auth/login\">Sign in with Google</a></body></html>' -> len > 0 PASS."
              },
              {
                "id": "F1/AC5-init-response",
                "result": "pass",
                "trace": "GET /auth/login -> _view_auth_login -> HttpResponseRedirect(oauth_auth_url) -> start_response called with '302 Found' -> oauth_init_response non-empty PASS."
              },
              {
                "id": "F1/AC5-init-status",
                "result": "pass",
                "trace": "init_status=302 in (200,301,302,303,307,308) PASS."
              },
              {
                "id": "F1/AC5-callback-response",
                "result": "pass",
                "trace": "GET /auth/callback?code=test-oauth-code&state=test-state -> _view_auth_callback_safe -> _view_auth_callback: exchange_code('test-oauth-code') -> mock returns {provider:'google',provider_id:'uid-f1-happy',...} -> handle_callback('google','uid-f1-happy',{...}) -> save_identity(...) -> real in-memory store -> returns record -> set_cookie('session','uid-f1-happy',...) -> HttpResponseRedirect('/') -> start_response called -> callback_response non-empty PASS."
              },
              {
                "id": "F1/AC5-callback-status",
                "result": "pass",
                "trace": "HttpResponseRedirect -> status 302 in (200,301,302,303,307,308) PASS."
              },
              {
                "id": "F1/AC5-session-cookie",
                "result": "pass",
                "trace": "response.set_cookie('session','uid-f1-happy',...) -> Set-Cookie header present -> set_cookie='session=uid-f1-happy; ...' -> 'session' in set_cookie.lower()=True -> assert satisfied PASS."
              }
            ]
          },
          "failure": {
            "test": "test_f1_failure_store_unavailable",
            "exercises": "CT1:store-unavailable",
            "result": "pass",
            "assertions": [
              {
                "id": "F1-failure-response",
                "result": "pass",
                "trace": "patch save_identity side_effect=ConnectionError. GET /auth/callback -> _view_auth_callback_safe -> _view_auth_callback: exchange_code -> mock returns uid-f1-failure data -> handle_callback -> save_identity raises ConnectionError -> propagates out of handle_callback -> _view_auth_callback raises ConnectionError -> caught by _view_auth_callback_safe except ConnectionError -> HttpResponseRedirect('/auth/login?error=store_unavailable') -> start_response called -> callback_response non-empty PASS."
              },
              {
                "id": "F1-failure-no-session",
                "result": "pass",
                "trace": "HttpResponseRedirect has no Set-Cookie -> set_cookie='' -> 'session' not in ''.lower()=True -> assert satisfied PASS."
              },
              {
                "id": "F1-failure-redirect-to-login",
                "result": "pass",
                "trace": "callback_status=302 in (301,302,...) -> location='/auth/login?error=store_unavailable' -> 'auth' in location.lower()=True AND 'login' in location.lower()=True -> assert satisfied PASS."
              }
            ]
          },
          "trace": "Walking skeleton flow C6->C2->C1 fully wired. GET / renders entry page (AC1: 200 non-empty HTML). /auth/login redirects 302 to OAuth provider (AC5 step 1). /auth/callback exchanges code via mock_oauth_provider -> handle_callback -> save_identity (real in-memory store) -> set_cookie(session, provider_id) + redirect 302 to / (AC5 step 2). Failure: ConnectionError from save_identity -> _view_auth_callback_safe catches -> redirect to /auth/login?error=store_unavailable, no session cookie (CT1:store-unavailable path fully satisfied)."
        }
      ]
    },
    "acceptance": {
      "layer_verdict": "pass",
      "per_ac": [
        {
          "ac": "AC1",
          "req_ref": "R1",
          "visible": {
            "file": "acceptance/visible/test_AC1.py",
            "result": "pass",